text;likes;words_amount;unique_word_count;char_count;sentiment
Here are my Shopify stores https://shopmrbeast.com/shop and https://feastables.com Comment yours below! (Also buy the new merch to get the secret video);90158;26;23;152;Very Positive
I cannot believe you actually pulled this off - this is LEGENDARY;152172;11;10;65;Very Positive
this is insanely epic...as we expected ;243214;7;7;39;Very Positive
This man is literally born to make History. Hats of to Jimmy and the crew.;38709;15;14;74;Very Positive
The 999,999,999 subscriber and the 100,000,001 subscriber:;122;11;7;58;Very Negative
RED DIAMOND PLAY BUTTON  Congrats Jimmy!!!;14452;6;6;42;Very Positive
Congratulations on a well deserved 100m and many more!;12580;9;9;54;Very Positive
I love how he says “our play button” knowing he wouldn’t be where he is without his friends. Huge congratulations man you deserve it!;5040;25;23;133;Very Positive
Trop aimable tes vidéo espérons que un jour je pourrais faire partie de tes vidéo et gagner ;22;17;15;92;Very Positive
Green light guy 1st winner was an absolute chad!;717;9;9;48;Very Positive
People often forget the Jimmy came from humble beginnings. But look where he is now, great amount of dedication and hard work. Hats off Jimmy;3143;25;24;141;Very Positive
Thank you Mr.Beast , couldn’t be more grateful for this life changing opportunity. Even though I couldn’t win the island, I’m incredibly happy for living this experience!;2403;30;25;170;Very Positive
Thank you very much for releasing this video;12;8;8;44;Very Positive
Your content has always been so wholesome and motivating at the same time, thank you MrBeast and crew.;853;18;17;102;Very Positive
MrBeast is truly on another level. Congratulations ;22469;7;7;51;Very Positive
"Honestly if I ever had the chance to participate in one of these I wouldn't care if I lost. It just seems so fun. 
Congrats Jimmy on 100m! ";3082;29;26;139;Very Positive
I love watching your content bro;3;6;6;32;Very Positive
Been subbed since 200k! Congrats jimmy on 100m. Now you just have to beat T series;4805;16;16;82;Very Negative
Man, Mr. Beast this is good stuff!;4582;7;7;34;Very Positive
The amount of people he has helped in a decade, congrats MrBeast you definitely deserved it!;1315;16;16;92;Very Positive
literally BFDI irl:;2;3;3;19;Very Negative
That red light green light guy was insane. Kinda sad he didn't win the island. was rooting for him ;848;20;18;99;Negative
The dude who passed that red line on a technicality had a evil villain genius IQ. Well played, sir!;6192;19;18;99;Very Positive
One of the few people I can say that deserves everything he has. Congrats, MrBeast!;747;15;15;83;Very Positive
MrBeast's 99,999,999 subscriber:;7;6;5;32;Very Negative
You’re the best YouTuber who will ever exist. It’s a pleasure to know you and watch your content ;6685;20;19;97;Very Positive
"Out of every creator on the platform, you deserved it the most!
Glad to see that fame has only motivated you to keep on giving to those around you! Truly inspirational.";1061;31;25;168;Very Positive
I think this is the best MrBeast video ever;8;9;9;43;Very Positive
Absolute fkn legend! Congrats to you and the team;2978;9;9;49;Very Positive
Chandler played a huge role in this massive success. I remember once I only used to see mrbeast videos just to see and hope chandler wins a challenge (which he never did until the island);919;35;30;187;Very Positive
Wholesome Ending  love you jimmy and team, so happy for your success ;219;12;12;69;Very Positive
Mrbeasts first subscriber:;2;3;3;26;Very Positive
I can't believe he has grown this much, its truly astonishing. He definitely deserves it more than anyone.;1234;19;18;106;Very Positive
"The fact that Chandler would be sweeping someone's floor to becoming a celebrity so many people in this  world know about is just so overwhelming for me.

Life is unpredictable. 

Thanks for giving such a good life ordinary common people around you Jimmy ,you have taught me that how much you have, doesn't matters you should always share cause those blessings will be a million times more valuable.";2261;70;56;399;Very Negative
Courage à toi ;1;3;3;14;Very Positive
There will never be enough appreciation for the actions that Jimmy has taken. Such a good guy.;908;17;17;94;Very Positive
That guy who got first place at the red light green light deserved an island of his own just for the mega brain play he did;2561;26;24;123;Very Negative
What a great experience! I was 39.7mil and when I tell you everything you see is exactly how it plays out is true. Such an amazing experience and I’m so happy I was able to be apart of it!;858;41;32;188;Very Positive
Mrbeast  3:33;4;3;3;13;Very Positive
This man is a legend. Seriously he will go down in history.;574;12;12;59;Very Positive
I loved the fact that all the finalist wanted to continue and didn't give up! Also, that 100M button is beautiful. Totally deserved, thank you for all the laughs, crazy challenges and fun! Keep it up and I hope someday I can appear on one of these great videos for the fun of it!;1203;55;41;279;Very Positive
Watching Jimmy open the play button was honestly so well deserved. Almost brought me to tears.;716;16;16;94;Very Positive
"Bro said"" this is ur first time opening our 100 million subscriber play button"" But it already has a ton of fingerprints on it";1;24;23;126;Very Negative
the guy who ran when jimmy was explaining that there was no time limit in red light green light is the genius;5984;22;19;109;Very Positive
You deserve it man! Happy for you Jimmy! :) Keep making amazing content!;356;12;11;72;Very Positive
Congrats to the whole team on this milestone. Really shows Jimmy’s mentality, saying “our” play button;1186;17;17;102;Very Positive
Yeah it was sooo epic!;4;5;5;22;Very Positive
So proud of jimmy for achieving something almost no has. He has provided me with entertainment for many years and I can’t think of anyone who deserves it more.;428;30;27;159;Very Positive
You definitely deserve this achievement jimmy, you're such a good person.;339;12;11;73;Very Positive
I can’t wait to see what you giveaway at 200M!;355;11;11;46;Very Positive
And now you have 335m subs;6;6;6;26;Very Positive
The amount of people he has helped in a decade. Congrats Jimmy, you totally deserve this success;1052;17;17;96;Very Positive
You guys are absolutely awesome!;336;5;5;32;Very Positive
I’ve been watching this channel for years and years, I’m so proud of how far he’s gotten. It’s crazy how fast he’s growing and all the things he’s doing for his fans, Congratulations jimmy!;503;40;30;189;Very Positive
The chances of entering this were literally 1 in a million.;1;11;11;59;Very Negative
I am shocked that they all passed on the 50k. Wow!;659;11;11;50;Very Positive
"This man and his crew deserve everything they have earned.

Congrats!";459;11;11;69;Very Positive
You deserve much more  (Can I have a private Island now?);2418;11;11;57;Very Positive
0:31 I am at ;10;5;5;13;Very Negative
Congrats - What an amazing acomplishment!;380;5;5;41;Very Positive
I can't wait to tell my grandkids this was the greatest youtuber of my time.;7734;16;15;76;Very Positive
This video made me cry;1;5;5;22;Very Positive
3:15 that was actually smart of the dude;672;9;9;40;Neutral
He’s really gonna have a lot of stories to tell his grandkids;2614;13;13;61;Positive
What a legend, giving everything back to the people who made you famous, you are doing gods work bro;234;19;18;100;Very Positive
9:47 ;1;2;2;5;Very Positive
He's really gonna have a lot of stories to tell his grandkids.;3560;13;13;62;Positive
Mr beast deserves everything;240;4;4;28;Very Positive
MrBeast definitely deserved it! He's done so much for us ;399;11;11;57;Very Positive
If I was there, I'd say yes to the money... Cause I'm Filipino, 5,000 is a lot in the Philippines.;1;23;20;98;Very Negative
Jimmy is an absolute blessing to so many… literally just found him — so amazing;307;14;13;79;Very Positive
MrBeast is a legend;446;4;4;19;Very Positive
It's so sweet how Jimmy always feels so bad for the losers and gets upset when they threw the money away;951;22;20;104;Very Positive
This is insanely epic....as we expected ;1;7;7;40;Very Positive
"Chris must be so proud that he's the first subscriber of a legendary Youtuber! 
Congrats on a well deserved 100M!";115;21;20;113;Very Positive
Jimmy is someone who deserved to hit this milestone for such a long time, as he is an inspiration to so many. We all are thankful for all the hard work you do, the entertainment you provide, and more. Congratulations!;257;40;34;217;Very Positive
big fan boss i am from Bangladesh;2;7;7;33;Very Positive
Congratulations Mr Beast! It’s been quite the ride… I honestly can’t remember when I started watching your videos. Can’t wait to see what else you will do!;446;30;27;155;Very Positive
This guy litterally is the definition of hard work pays off;301;11;11;59;Very Negative
Hes so experimental with his videos . Its amazing how he gives back to the people that struggle to get by . Good on you MrBeast .;406;24;23;129;Very Positive
99,999,999th and 100,000,001th pereon screaming rn;1;10;10;50;Very Negative
The plank scene had me on edge ;1676;7;7;31;Neutral
Congrats!;221;1;1;9;Very Positive
Can we just talk about how that contestant had a gut feeling she’d win the island and did in fact end up winning it;1133;25;25;115;Neutral
Next challenge: 1 billionth subscriber wins 10 islands;0;8;8;54;Very Positive
Congratulations Jimmy and the guys. You guys certainly deserve this thanks for always bringing a smile to so many people around the world.;109;23;21;138;Very Positive
Jimmy deserves this more than anyone else. His genuine care and dedication is unmatched. Congratulations!!;632;15;15;106;Very Positive
Mr Beast this was crazy man, Congrats ;746;7;7;38;Very Positive
Take love bro;6;3;3;13;Very Positive
i want an island pls;1258;5;5;20;Neutral
7:55 rip carrot;210;4;4;15;Very Negative
Congrats on 100M Jimmy!! You really deserve it!! For the people  you have helped in the past and now, you defo  deserve it!!;207;23;18;124;Very Positive
10:21  nolan;0;3;3;12;Very Negative
Man you are really a legendary personality , It would be good If I was able to join your games !;151;19;19;96;Very Positive
Jimmy will have a lot of stories to tell his grandkids. Your a fkn legend keep it up;745;18;17;84;Very Positive
3:20 smart AF;548;4;4;13;Very Positive
The first subscriber;5;3;3;20;Very Positive
The greatest YouTuber to have ever lived! Hugely deserved! ;443;9;9;59;Very Positive
Congratulations to the winners!;106;4;4;31;Very Positive
These sets are absolutely incredible, it's insane how far jimmy has come;448;13;13;72;Very Positive
